Item Id	Item Name	Price	Sales	Shop Name	Commission Rate	Commission	Product Link	Offer Link
10000000001	Acesse a Shopee por intermédio do nosso Link de Afiliado 		1	a	1	1	colecao	https://s.shopee.com.br/5VPQAX9acB
10000000002	Conheça Nossa Seleção de Produtos do Mercado Livre		1	a	1	1	colecao	https://mercadolivre.com/sec/1gRMfvP
10000000003	Acesse a Amazon por intermédio do nosso Link de Afiliado 		1	a	1	1	coleção	https://amzn.to/47dhhOz
31000000091	Extrato de Própolis 30 ml Apis Flora	16,6	1	a	13	1	https://amzn.to/3PbTQPC	https://amzn.to/3PbTQPC
MLB26796581	Creatina Monohidratada Pura 500g Dark Lab Unidade	47,49	n	n	n	n	https://www.mercadolivre.com.br/creatina-monohidratada-pura-500g-dark-lab-unidade/p/MLB26796581?pdp_filters=item_id%3AMLB4812143184#polycard_client=affiliates&wid=MLB4812143184&sid=affiliates	https://mercadolivre.com/sec/1PSaUaz
21897401555	AMEND KIT EXPERTISE COMPLETE REPAIR SHAMPOO 250ML E CONDICIONADOR 250ML	80,34	391	AMEND OFICIAL	22%	R$17,05	https://shopee.com.br/product/1077804858/21897401555	https://s.shopee.com.br/7KrB66dqdQ
19699891709	Mix-03 um sérum multirreparador com mix de 4 ativos: 6% multivitaminas Oficial	26,99	21	F.Promo	3%	R$0,81	https://shopee.com.br/product/1640407425/19699891709	https://s.shopee.com.br/70EKhUf7JK
19496935117	Amend Expertise Complete Repair Kit Shampoo e Condicionador 250ml	80,34	489	BEAUTY ON 	16%	R$12,40	https://shopee.com.br/product/477051595/19496935117	https://s.shopee.com.br/7AXktneTyN
23892784393	Kit Shampoo e Condicionador Antidanos Bendito Loiro Haskell 300ml	110,79	70	Rotha Cosméticos	25%	R$30,11	https://shopee.com.br/product/773409605/23892784393	https://s.shopee.com.br/8KjiGGpeZ4
22498202529	Kit Shampoo e Condicionador Reconstrutor Hidratante Uso Obrigatório Truss	229,98	0	UniBeleza Cosméticos	10%	R$23,00	https://shopee.com.br/product/313283487/22498202529	https://s.shopee.com.br/8V38SZp1E7
22298489702	Limpador Pincel Esponja Maquiagem Elétrico USB Automático Lava Seca Armazena	31,95	1mil+	máquinas shop	12%	R$3,24	https://shopee.com.br/product/1381918631/22298489702	https://s.shopee.com.br/6pum9LVrKv
22293255997	Espelho De Maquiagem Mesa Inteligente Com Luz LED USB Portátil Dobrável Ajustável Touch Oval	43,79	7mil+	Nuvem  Tech	7%	R$3,07	https://shopee.com.br/product/1128533277/22293255997	https://s.shopee.com.br/70ECLeVDzy
58251822986	Loção Noturna Desodorante Corporal Nativa Spa Orquídea Noire – 400ml	13,79	11	Max Perfumes	13%	R$1,79	https://shopee.com.br/product/1420372901/58251822986	https://s.shopee.com.br/7AXcXxUaf1
40708740721	Kit 10 Esmaltes Impala Marrom Nude Esmalte Capivara Atacado	52,90	5mil+	Doce Berço	12%	R$2,39	https://shopee.com.br/product/291265983/40708740721	https://s.shopee.com.br/3LKtyujBRI
20299556816	Conjunto de cortador de unhas para pedicure, 16 peças, aço inoxidável com bolsa dobrável	21,98	10mil+	Lenda oriental	12%	R$2,15	https://shopee.com.br/product/1377846021/20299556816	https://s.shopee.com.br/3VeKBDiY6L
23897892314	Creme AntiEstrias Removedor Estrias 200g Morena Brasil – Ação Poderosa com Colágeno e Elastina	38,9	10mil+	WANDER-SHOP	33%	R$12,84	https://shopee.com.br/product/231816406/23897892314	https://s.shopee.com.br/3fxkNWhulO
22597349492	Escova Secadora Alisador Elétrica Quente Cabelo Com 3 Em1 Hair Styler 110V	45,99	10mil+	HELLOBRASIL	7%	R$2,73	https://shopee.com.br/product/407952755/22597349492	https://s.shopee.com.br/3qHAZphHQR
19199649259	Caneta  fio a fio para Sobrancelha e Barba À Prova D 'água Microblanding	19,39	30mil+	AR Mod Official	12%	R$1,92	https://shopee.com.br/product/1057711992/19199649259	https://s.shopee.com.br/2qOdNzl5SH
22293756813	Kit de Esmaltes Impala Roxinho Rosa Perolado Clássicos Mais Vendidos Atacado	14,95	4mil+	Avili Cosmética	13%	R$1,94	https://shopee.com.br/product/1449290898/22293756813	https://s.shopee.com.br/30i3aIkS7K
23293942172	Óleo Clareador de Axilas e Virilha Secrets Woman (110 ml) SWISS BEAUTY | Corporal, axilas e virilha	35,62	10mil+	Bela Beleza Oficial	23%	R$8,91	https://shopee.com.br/product/1391354759/23293942172	https://s.shopee.com.br/4fqHZMe6jg
58200716841	Principia Kit - Anti-manchas- Essencial	168,23	8mil+	Principia Skincare	13%	R$22,72	https://shopee.com.br/product/373261329/58200716841	https://s.shopee.com.br/4q9hlfdTOj
42821781287	Kit Completo Karseell Máscara 500 g + condicionador 1L + Shampoo 1L + Óleo karseell P 50ml	75,00	20mil+	karseell®	17%	R$8,84	https://shopee.com.br/product/1179613076/42821781287	https://s.shopee.com.br/50T7xycq3m
18858554736	Conjunto de 3 batons / fosco aveludado/Batom Fosco Aveludado	25,99	10mil+	fashionmz.br	8%	R$1,44	https://shopee.com.br/product/889221854/18858554736	https://s.shopee.com.br/5AmYAHcCip
26310323709	KIKO Milano Conjunto de pincéis de maquiagem / 5pcs+Saco organizador	49,98	1mil+	maliya1.br	10%	R$1,18	https://shopee.com.br/product/1160892777/26310323709	https://s.shopee.com.br/40aam8ge5c
23998648815	Wella Pro Oil Reflections Óleo 100ml	55,90	10mil+	Cosméticos Brasil 	20%	R$11,00	https://shopee.com.br/product/275739347/23998648815	https://s.shopee.com.br/4Au0yRg0kf
20846672583	Clareador de Virilha e Axila Creme Clareador Partes Intimas - Clear Beauty Original	28,9	30mil+	Corpus	23%	R$6,65	https://shopee.com.br/product/768604265/20846672583	https://s.shopee.com.br/4LDRAkfNPi
22831010594	Depilador Elétrico Batom Indolor Portátil Facial Touch  Removedor de Pêlos Indesejados Recarregável	20,65	60mil+	Maria Flor Variedades	16%	R$3,18	https://shopee.com.br/product/767949698/22831010594	https://s.shopee.com.br/4VWrN3ek4l
23493397958	Kit 16 Pçs/Set Profissional Aço inoxidável Para Manicure Pedicure	18,81	60mil+	Arara.store	11%	R$2,09	https://shopee.com.br/product/1005980154/23493397958	https://s.shopee.com.br/qdZ0JshW5
18598354285	Kit Maleta Maquiagem completo Profissional Com Espelho e Luz Led e paleta de maquiagem	90,14	34	TW1 TECH LTDA	10%	R$8,49	https://shopee.com.br/product/1630928956/18598354285	https://s.shopee.com.br/10wzCcs4B8
18897459506	Bolsa De Cosmético  Com Grande Capacidade Portátil Viagem Cosméticos Para Viagem 884/774/311/916	20,90	50mil+	BBQalegre	10%	R$1,59	https://shopee.com.br/product/739972532/18897459506	https://s.shopee.com.br/1BGPOvrQqB
23898657071	Depilador Eletrico Feminino Recarregável Removedor De Pelos Navalha Dupla	40,99	7mil+	máquinas shop	12%	R$3,36	https://shopee.com.br/product/1381918631/23898657071	https://s.shopee.com.br/BNsD5vEs1
23497647985	Limpador De Pincel Esponja Maquiagem Elétrico USB Automático Recarregável Lava Armazena Bivolt	28,99	5mil+	MISULI_BR	8%	R$2,32	https://shopee.com.br/product/378093609/23497647985	https://s.shopee.com.br/20pWOSoG9Q
22310437916	Lixador de Pé Elétrico - Esfoliador Tira Calos Pedicure Portátil  Lixa Elimina Calo Portátil Usb Pilha	19,99	20mil+	DAFUSHOP Official Store	9%	R$1,53	https://shopee.com.br/product/378486098/22310437916	https://s.shopee.com.br/2B8walncoT
21797681952	Kit Terapia Capilar Óleo de Coco + Rícino + Alecrim Natuhair 60ml	28,45	50mil+	Zares Cosméticos	23%	R$7,34	https://shopee.com.br/product/844782615/21797681952	https://s.shopee.com.br/2LSMn4mzTW
20797676896	Batom Cremoso Creamy Matte GLASS BY RUBY ROSE	19,90	5mil+	Espaço da Blz	23%	R$4,12	https://shopee.com.br/product/722975682/20797676896	https://s.shopee.com.br/2VlmzNmM8Z
22893910758	Base Líquida Bruna Tavares BT Skin Acabamento Aveludado 40 ml	26,00	50mil+	WH_SHOP	3%	R$0,78	https://shopee.com.br/product/1377341349/22893910758	https://s.shopee.com.br/1LZpbEqnVM
9347943263	Kit 10 peças pincel kabuki precisão  Conjunto de Maquiagem para Sombra Delineador Lábios Pó Base	12,99	80mil+	yaya.br	7%	R$0,84	https://shopee.com.br/product/430146238/9347943263	https://s.shopee.com.br/1gCfzqpWpS
23594279245	Lixador de Pé Elétrico - Esfoliador Tira Calos Pedicure Portátil com Removedor Recarregável USB	19,99	10mil+	YC SHOPPING	13%	R$2,60	https://shopee.com.br/product/1530365385/23594279245	https://s.shopee.com.br/1qW6C9otUV
21699850579	KIT NIVEA Loção Hidratante Milk Pele Seca a Extrasseca 400ml 2 Unidades BBB 26	39,9	10mil+	NIVEA OFICIAL	15%	R$5,99	https://shopee.com.br/product/502619181/21699850579	https://s.shopee.com.br/8pfqX1OFHs
23993167873	Paleta de Sombras Mystic Glow 18 Cores RUBY ROSE	28,9	5mil+	Espaço da Blz	23%	R$6,65	https://shopee.com.br/product/722975682/23993167873	https://s.shopee.com.br/8fMQKiOscr
20199357121	KIT COMPLETO MASCARA + SHAMPOO + CONDICIONADOR  KARSEELL ORIGINAL MACA POWER COLLAGEN ORIGINAL IMPORTADO Karseell .!!!!!	50,00	10mil+	KASEEN COSMETICS OFICIAL	23%	R$11,50	https://shopee.com.br/product/300863563/20199357121	https://s.shopee.com.br/9AIgvdMyby
21799497981	Escova Rotativa Elétrica Secador de cabelo Professinal 2 em 1	83,50	10mil+	Arara.store	11%	R$9,02	https://shopee.com.br/product/1005980154/21799497981	https://s.shopee.com.br/8zzGjKNbwx
23793082548	Óleo Elseve Extraordinário Paris 100ml	46,69	40mil+	Droga Clara	18%	R$8,40	https://shopee.com.br/product/1045085918/23793082548	https://s.shopee.com.br/8AQ9jnQmdo
22499255714	Base Mate Cobre Tudo 30ml Boca / Rosa Beauty	17,5	6mil+	AIM Cosméticos	3%	R$0,53	https://shopee.com.br/product/1659347300/22499255714	https://s.shopee.com.br/806jXURPyn
18598043780	Kit 3 Necessaire Maquiagem Transparente WashBag A Prova De Água  332	29,00	10mil+	atacado loja	10%	R$2,60	https://shopee.com.br/product/1074623551/18598043780	https://s.shopee.com.br/8V308PPVxu
20178281640	Kit Giovanna Baby Blue, Loção Hidratante, Desodorante Aerosol, Body Splash, Deo Colônia e sabonete	69,98	674	Fina Sintonia oficial	18%	R$8,03	https://shopee.com.br/product/251254083/20178281640	https://s.shopee.com.br/8KjZw6Q9It
19099260299	Secador de Cabelo 110v Profissional 3200w - Voltagem 110v--6881	54,99	4mil+	Bazar das Flores Artificiais	13%	R$6,50	https://shopee.com.br/product/818350485/19099260299	https://s.shopee.com.br/AABE7TJAaG
4696505626	NIVEA SUN Protetor Solar Protect & Hidrata FPS 30 400ml BBB 26	72,9	856	NIVEA OFICIAL	73%	R$53,22	https://shopee.com.br/product/502619181/4696505626	https://s.shopee.com.br/9zrnvAJnvF
23297443289	Motorzinho Para Lixar Calos e Rachaduras Ideal Para Pedicures	42,00	40mil+	XUXU BELEZA Oficial	3%	R$1,08	https://shopee.com.br/product/341061019/23297443289	https://s.shopee.com.br/AUo4W5HtuM
19799202202	Karseell Collagen Tratamento Capilar 500g	114,00	100mil+	karseell®	21%	R$4,81	https://shopee.com.br/product/1179613076/19799202202	https://s.shopee.com.br/9pYNirKRGI
23693189421	GUI ANA Organizador Prateleira Diamante Acrílico Porta Maquiagem Beleza linhas	21,89	40mil+	GUI ANA SHOP	11%	R$2,41	https://shopee.com.br/product/1299283009/23693189421	https://s.shopee.com.br/9fExWYL4bH
17793817412	Escova Secadora Alisador Elétrica Quente Cabelo Com 3 Em1 Hair Styler FANG APENAS 110V	45,89	90mil+	Fang.store	3%	R$1,23	https://shopee.com.br/product/526596865/17793817412	https://s.shopee.com.br/6Af5M7YOhc
22597347421	NIVEA SUN Protetor Solar Protect & Hidrata Ultra FPS 60 150ml BBB 26	40,90	183	NIVEA OFICIAL	43%	R$18,45	https://shopee.com.br/product/502619181/22597347421	https://s.shopee.com.br/60Lf9oZ22b
23398539116	Natura Tododia Framboesa e Pimenta Vermelha - Linha Completa - Escolha seu Item	69,99	272	A2 Perfumaria	11%	R$5,28	https://shopee.com.br/product/283238461/23398539116	https://s.shopee.com.br/6VHvkjX81i
2986843310	NIVEA Loção Hidratante Milk Pele Seca a Extrasseca 200ml BBB 26	17,90	40mil+	NIVEA OFICIAL	15%	R$2,39	https://shopee.com.br/product/502619181/2986843310	https://s.shopee.com.br/6KyVYQXlMh
23393092888	kit Progressiva Karseell 500g + Shampoo Karseell 500g	51,00	10mil+	KARSEEN COSMETICS 	23%	R$11,48	https://shopee.com.br/product/319532890/23393092888	https://s.shopee.com.br/5VPOYtaw3Y
24034090678	Paleta de Sombras com 40 Cores - Acabamento Matte e Shimmer, Alta Pigmentação, Efeito Esfumado e Longa Duração.	28,85	30mil+	Choice Oficial	11%	R$2,31	https://shopee.com.br/product/1006215031/24034090678	https://s.shopee.com.br/5L5yMabZOX
11856449562	Kit Nutrição Capilar Profissional Soul Care 300g | Shampoo Condicionador Máscara com Queratina	69,99	405	Loja.SoulCare	38%	R$26,60	https://shopee.com.br/product/443754236/11856449562	https://s.shopee.com.br/5q2ExVZfNe
22998876843	Boticário Nativa Spa Uva Merlot Kit Hidratante 400ml + Refil 350ml	113,91	663	Kay Perfumaria	14%	R$7,97	https://shopee.com.br/product/1078994982/22998876843	https://s.shopee.com.br/7VASwZTK00
23792785771	Principia Kit Anti-Acne Trio Gel de Limpeza GL-01 + Sérum Mix-01 + Protetor Solar Facial PS-01	129,75	30mil+	Principia Skincare	3%	R$3,89	https://shopee.com.br/product/373261329/23792785771	https://s.shopee.com.br/7Kr2kGTxKz
23698691180	Kit Cronograma Capilar Completo Karseell – 3 Máscaras (Hidratação, Nutrição e Reconstrução)	39,00	40mil+	Karseell Oficial 	16%	R$4,80	https://shopee.com.br/product/407760070/23698691180	https://s.shopee.com.br/7pnJLBS3K6
19399262306	Kit Kameell Máscara 500g + Óleo 50ml | Hidratação Profunda, Reconstrução e Brilho Intenso	38,90	10mil+	Kameell	24%	R$7,00	https://shopee.com.br/product/1110838097/19399262306	https://s.shopee.com.br/6pum9LVrLw
21899305305	Depilador de Sombrancelha Buço Nariz Orelha Rosto Facial Elétrico Tira Pelos USB Recarregável Profissional Portátil	19,99	100mil+	IMPÉRIO LIFE	3%	R$0,60	https://shopee.com.br/product/1215185317/21899305305	https://s.shopee.com.br/7AXcXxUag2
26037586168	NIVEA Sabonete Líquido Óleo de Banho - 200 ml	34,9	20mil+	NIVEA OFICIAL	18%	R$6,28	https://shopee.com.br/product/502619181/26037586168	https://s.shopee.com.br/70ECLeVE11
23098889747	Paleta de Sombras Glass Mirror Shade 18 Cores Ruby Rose Make Completa Profissional Envio Full	41,54	6mil+	Ge Distribuidora	7%	R$2,76	https://shopee.com.br/product/1617341510/23098889747	https://s.shopee.com.br/3VeKBDiY7M
19399548226	NIVEA Q10 Sérum Antissinais Expert Dupla Ação 30ml BBB 26	70,90	3mil+	NIVEA OFICIAL	33%	R$28,68	https://shopee.com.br/product/502619181/19399548226	https://s.shopee.com.br/3LKtyujBSL
22299034318	NIVEA Loção Hidratante Milk Pele Seca a Extrasseca 200ml -3 Unidades BBB 26	45,9	10mil+	NIVEA OFICIAL	15%	R$6,89	https://shopee.com.br/product/502619181/22299034318	https://s.shopee.com.br/3qHAZphHRS
3084524652	NIVEA Hidratante Desodorante Soft Milk 200ml BBB 26	17,9	10mil+	NIVEA OFICIAL	15%	R$2,69	https://shopee.com.br/product/502619181/3084524652	https://s.shopee.com.br/2qOdNzl5TI
20298293546	Kit Skin Care Clareador Facial Vitamina C para Manchas, Melasma e Anti-idade Sérum, Sabonete, Água Micelar Gel	79,90	1mil+	Senhora Di Casa	15%	R$3,59	https://shopee.com.br/product/329203540/20298293546	https://s.shopee.com.br/2g5DBglioH
19197398472	Amend Expertise KIT Marula Nutrition Completo com 5 Produtos	183,59	2mil+	AMEND OFICIAL	28%	R$52,49	https://shopee.com.br/product/1077804858/19197398472	https://s.shopee.com.br/3B1TmbjonO
18497402527	AMEND MÁSCARA NUTRITIVA EXPERTISE MARULA FABULOUS NUTRITION 300G	38,97	8mil+	AMEND OFICIAL	28%	R$13,03	https://shopee.com.br/product/1077804858/18497402527	https://s.shopee.com.br/30i3aIkS8N
18232758480	NIVEA Hidratante Corporal Beleza Radiante Pele Uniforme 200ml BBB 26	19,9	7mil+	NIVEA OFICIAL	18%	R$3,58	https://shopee.com.br/product/502619181/18232758480	https://s.shopee.com.br/4q9hlfdTPk
22892447218	AMEND KIT EXPERTISE COMPLETE REPAIR | 5 PRODUTOS	185,58	1mil+	AMEND OFICIAL	22%	R$41,76	https://shopee.com.br/product/1077804858/22892447218	https://s.shopee.com.br/4fqHZMe6kj
16693709236	NIVEA Hidratante Facial Beleza Radiante 7 em 1 100g BBB 26	31,90	20mil+	NIVEA OFICIAL	15%	R$4,49	https://shopee.com.br/product/502619181/16693709236	https://s.shopee.com.br/50T7xycq4p
23493478982	KIT lili 350ml creme e perfume acetinado corpo e mãos hidratante lily lulli cuide se bem	45,15	8mil+	AthenasDigital	3%	R$0,69	https://shopee.com.br/product/1339254692/23493478982	https://s.shopee.com.br/4Au0yRg0lg
22097296846	Protetor Solar facial PS-01 FPS 60	44,1	100mil+	Principia Skincare	3%	R$1,32	https://shopee.com.br/product/373261329/22097296846	https://s.shopee.com.br/40aam8ge6f
41660375635	Blush Líquido RARE BEAUTY Soft Pinch 7.5ML	29,99	1mil+	Beautyup02.br	7%	R$0,85	https://shopee.com.br/product/955204066/41660375635	https://s.shopee.com.br/4VWrN3ek5m
22398320827	Removedor Cravos e Espinhas Extrator de Cravos Sucção a Vácuo Aparelho Recarregável Sugador Remove Acne	25,99	8mil+	OPA LEGAL	7%	R$1,82	https://shopee.com.br/product/386512962/22398320827	https://s.shopee.com.br/4LDRAkfNQl
22494497880	Kit collagen Shampoo Condicionador Purificador 1L Máscara Hidratação 500g Óleo Reparador 60ml	59,90	7mil+	KameellBR	17,5%	R$7,63	https://shopee.com.br/product/1247395009/22494497880	https://s.shopee.com.br/qdZ0JshX6
23394306708	Lixador de Pé Elétrico - Esfoliador Tira Calos Pedicure Portátil Marisa Lixa Elimina Calo Portátil Usb Pilha	19,99	20mil+	JL SUPER STORE	12%	R$2,40	https://shopee.com.br/product/1522364802/23394306708	https://s.shopee.com.br/gK8o0tKs5
23898526571	Protetor solar facial PS-01 FPS 40	39,00	10mil+	Principia Skincare	3%	R$1,16	https://shopee.com.br/product/373261329/23898526571	https://s.shopee.com.br/1BGPOvrQrC
22794423162	Kit Capilar Óleo Extraordinário NEW HAIR (3 itens) - Shampoo, Condicionador e Máscara	28,9	8mil+	Bela Beleza Oficial	21%	R$6,07	https://shopee.com.br/product/1391354759/22794423162	https://s.shopee.com.br/10wzCcs
